{
  "metadata": {
    "domain": "data-flow-diagram",
    "version": "v2-dfd",
    "level": "context",
    "title": "InsureCorp Insurance System - Context Diagram",
    "description": "System context showing external data integrations, regulatory compliance, and industry partnerships",
    "generatedAt": "2026-03-21T00:00:00Z"
  },
  "elements": {
    "nodes": [
      {
        "data": {
          "id": "boundary_external",
          "type": "boundary",
          "name": "External Systems",
          "boundaryType": "trust-boundary"
        },
        "classes": ["boundary"]
      },
      {
        "data": {
          "id": "boundary_regulatory",
          "type": "boundary",
          "name": "Regulatory",
          "boundaryType": "trust-boundary"
        },
        "classes": ["boundary"]
      },
      {
        "data": {
          "id": "boundary_internal",
          "type": "boundary",
          "name": "InsureCorp Internal",
          "boundaryType": "trust-boundary"
        },
        "classes": ["boundary"]
      },
      {
        "data": {
          "id": "insurecorp_system",
          "type": "process",
          "role": "system-of-interest",
          "name": "InsureCorp Insurance Platform",
          "number": "0",
          "description": "Integrated insurance operations and analytics"
        },
        "classes": ["system"]
      },
      {
        "data": {
          "id": "ext_credit_bureaus",
          "type": "external_entity",
          "name": "Credit Bureaus",
          "description": "TRW, Equifax, Experian",
          "parent": "boundary_external"
        }
      },
      {
        "data": {
          "id": "ext_mvr_providers",
          "type": "external_entity",
          "name": "MVR/Record Providers",
          "description": "Motor Vehicle Records, Claims History",
          "parent": "boundary_external"
        }
      },
      {
        "data": {
          "id": "ext_market_data",
          "type": "external_entity",
          "name": "Market Data Providers",
          "description": "Reinsurance, Economic, Currency, Rates, Credit Ratings",
          "parent": "boundary_external"
        }
      },
      {
        "data": {
          "id": "ext_weather_cat",
          "type": "external_entity",
          "name": "Weather & Catastrophe",
          "description": "Weather forecasts, Catastrophe exposure",
          "parent": "boundary_external"
        }
      },
      {
        "data": {
          "id": "ext_demographics",
          "type": "external_entity",
          "name": "Demographics & Valuation",
          "description": "Demographics, Property valuation, Competitor pricing",
          "parent": "boundary_external"
        }
      },
      {
        "data": {
          "id": "ext_compliance_lists",
          "type": "external_entity",
          "name": "Compliance Data",
          "description": "Sanctions, PEP, AML lists",
          "parent": "boundary_external"
        }
      },
      {
        "data": {
          "id": "regulator_apra",
          "type": "external_entity",
          "name": "APRA Regulator",
          "description": "Australian Prudential Regulation Authority",
          "parent": "boundary_regulatory"
        }
      },
      {
        "data": {
          "id": "ext_reinsurers",
          "type": "external_entity",
          "name": "Reinsurance Partners",
          "description": "Treaty reinsurers, RI brokers",
          "parent": "boundary_external"
        }
      },
      {
        "data": {
          "id": "ext_brokers",
          "type": "external_entity",
          "name": "Insurance Brokers",
          "description": "Intermediaries, distribution partners",
          "parent": "boundary_external"
        }
      },
      {
        "data": {
          "id": "ext_industry",
          "type": "external_entity",
          "name": "Industry Bodies",
          "description": "Insurance Council, Catastrophe Claims Index",
          "parent": "boundary_external"
        }
      },
      {
        "data": {
          "id": "ext_government",
          "type": "external_entity",
          "name": "Government",
          "description": "Disaster relief, community programs",
          "parent": "boundary_external"
        }
      },
      {
        "data": {
          "id": "ds_external_feeds",
          "type": "data_store",
          "name": "External Feeds Database",
          "description": "Inbound: Credit, MVR, Market, Weather, Demographics, Compliance",
          "parent": "boundary_internal",
          "tables": 21,
          "domain": "externals"
        }
      },
      {
        "data": {
          "id": "ds_operational",
          "type": "data_store",
          "name": "Operational Database",
          "description": "7 source systems: Actuarial, Claims, Policy, Pricing, Reinsurance, Risk, Underwriting",
          "parent": "boundary_internal",
          "tables": 140,
          "domain": "SYSTEMS"
        }
      },
      {
        "data": {
          "id": "ds_datalake",
          "type": "data_store",
          "name": "Data Lake & Vault",
          "description": "Data Vault 2.0: 60 tables, Hub-Link-Satellite topology",
          "parent": "boundary_internal",
          "tables": 60,
          "domain": "Data Vault"
        }
      },
      {
        "data": {
          "id": "ds_analytics_star",
          "type": "data_store",
          "name": "Analytics Data Warehouse",
          "description": "Star Schema: 16 dimensions, 7 facts, 3 aggregates (26 tables)",
          "parent": "boundary_internal",
          "tables": 26,
          "domain": "Analytics"
        }
      },
      {
        "data": {
          "id": "ds_analytics_snowflake",
          "type": "data_store",
          "name": "Cloud Data Warehouse",
          "description": "Snowflake Schema: 13 reference, 17 dimensions, 7 facts (37 tables)",
          "parent": "boundary_internal",
          "tables": 37,
          "domain": "Cloud Warehouse"
        }
      },
      {
        "data": {
          "id": "ds_exchange_feeds",
          "type": "data_store",
          "name": "Outbound Exchange Database",
          "description": "APRA (5), Reinsurance (3), Industry (4), Brokers (2), Government (2), Audit (2)",
          "parent": "boundary_internal",
          "tables": 18,
          "domain": "exchange"
        }
      },
      {
        "data": {
          "id": "process_uw",
          "type": "process",
          "name": "Underwriting Engine",
          "number": "1.1",
          "parent": "boundary_internal"
        }
      },
      {
        "data": {
          "id": "process_claims",
          "type": "process",
          "name": "Claims Management",
          "number": "1.2",
          "parent": "boundary_internal"
        }
      },
      {
        "data": {
          "id": "process_pricing",
          "type": "process",
          "name": "Actuarial Pricing",
          "number": "1.3",
          "parent": "boundary_internal"
        }
      },
      {
        "data": {
          "id": "process_etl",
          "type": "process",
          "name": "ETL & Data Integration",
          "number": "1.4",
          "parent": "boundary_internal"
        }
      },
      {
        "data": {
          "id": "process_reporting",
          "type": "process",
          "name": "Reporting & Analytics",
          "number": "1.5",
          "parent": "boundary_internal"
        }
      },
      {
        "data": {
          "id": "process_compliance",
          "type": "process",
          "name": "Compliance & Regulatory",
          "number": "1.6",
          "parent": "boundary_internal"
        }
      }
    ],
    "edges": [
      {
        "data": {
          "id": "f1_credit",
          "source": "ext_credit_bureaus",
          "target": "insurecorp_system",
          "type": "data_flow",
          "label": "Credit Data",
          "dataElements": [
            "Credit scores",
            "Payment history",
            "Defaults"
          ],
          "classification": "confidential",
          "protocol": "SFTP/API",
          "frequency": "daily"
        }
      },
      {
        "data": {
          "id": "f2_mvr",
          "source": "ext_mvr_providers",
          "target": "insurecorp_system",
          "type": "data_flow",
          "label": "MVR/Claims History",
          "dataElements": [
            "Driving records",
            "Claims history",
            "Violations"
          ],
          "classification": "confidential",
          "protocol": "SFTP/API",
          "frequency": "daily"
        }
      },
      {
        "data": {
          "id": "f3_market",
          "source": "ext_market_data",
          "target": "insurecorp_system",
          "type": "data_flow",
          "label": "Market Data",
          "dataElements": [
            "Rates",
            "Indices",
            "Economic data"
          ],
          "classification": "internal",
          "protocol": "API",
          "frequency": "hourly"
        }
      },
      {
        "data": {
          "id": "f4_weather",
          "source": "ext_weather_cat",
          "target": "insurecorp_system",
          "type": "data_flow",
          "label": "Weather & CAT",
          "dataElements": [
            "Forecasts",
            "Catastrophe exposure"
          ],
          "classification": "internal",
          "protocol": "API",
          "frequency": "6-hourly"
        }
      },
      {
        "data": {
          "id": "f5_demographics",
          "source": "ext_demographics",
          "target": "insurecorp_system",
          "type": "data_flow",